{
  "$schema": "https://json-schema.org/draft/2020-12/schema",
  "$id": "https://locked-legal-advisor.local/schemas/judgment.schema.json",
  "title": "Judgment",
  "description": "Resolución judicial original (materia prima del corpus). NUNCA se usa directamente para responder al usuario (Regla 13). Espejo TS: services/models/judgment.ts",
  "type": "object",
  "additionalProperties": false,
  "required": [
    "id",
    "title",
    "court",
    "date",
    "resolution_number",
    "jurisdiction",
    "legal_area",
    "topics",
    "original_language",
    "file_path",
    "summary_internal",
    "created_at",
    "updated_at"
  ],
  "properties": {
    "id": { "type": "string", "minLength": 1 },
    "title": { "type": "string", "minLength": 1 },
    "court": { "type": "string", "minLength": 1 },
    "date": {
      "type": "string",
      "pattern": "^\\d{4}-(0[1-9]|1[0-2])-(0[1-9]|[12]\\d|3[01])$",
      "description": "Fecha de la resolución (YYYY-MM-DD). La validez de calendario completa (p. ej. rechazar 2026-02-31) la asegura el espejo TS (isIsoDate)."
    },
    "resolution_number": {
      "type": "string",
      "minLength": 1,
      "description": "Identificador oficial (o ECLI). Sin él no hay trazabilidad (Regla 9)."
    },
    "jurisdiction": { "type": "string", "minLength": 1 },
    "legal_area": {
      "enum": ["marcas", "propiedad_intelectual", "patentes", "procesal"],
      "description": "Vocabulario cerrado; ampliar exige decisión explícita."
    },
    "topics": {
      "type": "array",
      "uniqueItems": true,
      "items": { "type": "string", "minLength": 1 }
    },
    "original_language": {
      "type": "string",
      "pattern": "^[a-z]{2}(-[A-Z]{2})?$"
    },
    "file_path": {
      "type": "string",
      "pattern": "^data/source_judgments/(?!.*\\.\\.).+$",
      "description": "Ruta relativa al original dentro de data/source_judgments/, con nombre de archivo y sin '..' (anti path-traversal, Regla 13)."
    },
    "summary_internal": {
      "type": "string",
      "minLength": 1,
      "description": "Resumen interno de catalogación. JAMÁS servible al usuario."
    },
    "created_at": {
      "type": "string",
      "format": "date-time",
      "pattern": "^\\d{4}-\\d{2}-\\d{2}T\\d{2}:\\d{2}:\\d{2}(\\.\\d+)?(Z|[+-]\\d{2}:\\d{2})$"
    },
    "updated_at": {
      "type": "string",
      "format": "date-time",
      "pattern": "^\\d{4}-\\d{2}-\\d{2}T\\d{2}:\\d{2}:\\d{2}(\\.\\d+)?(Z|[+-]\\d{2}:\\d{2})$"
    }
  }
}
